,name,url,batch,vertical,description,dead,has_ff,all_ff
0,Thunderpod,https://www.thunderpod.com/,w2020,,Social Fitness App where content is consumed in the form of challenges! ,False,False,False
1,Dinesafe,https://dinesafe.org,s2018,B2B,We crowdsource food poisoning reports and help detect and prevent outbreaks.,False,False,False
2,Parakey,http://parakey.com,s2005,,,False,,
3,Demeanor.co,https://www.demeanor.co,s2018,Media,Now part of thentwrk.com,False,False,False
4,Oolu,http://oolusolar.com,s2015,Hardware,Oolu is a social enterprise that finances high quality solar products to rural West African households.,False,True,False
5,Ubiq,https://www.goubiq.com,s2017,Enterprise,Screen-sharing for enterprise conference rooms,False,False,False
6,Hellobill,http://hellobill.io,s2016,Enterprise,"Hellobill aggregates all your business bills, automatically, every month.",True,False,False
7,NaturAll Club,http://naturallclub.com,w2019,Consumer,Frozen beauty products.,False,True,False
8,Unnyhog,http://unnyhog.com,w2016,Consumer,"Video game development company.
We are creating unique and revolutionary games.
We want to push game industry forward.",True,True,False
9,Morphle,http://morphle.in,w2020,Healthcare,Microscopy Automation + Assistive Intelligence,False,False,False
10,Spenny,http://spennyapp.com,w2020,,"Acorns for India. Every time you swipe you make a digital transaction, we round up the amount to the nearest 10 INR and invest it for you, automatically. ",False,False,False
11,Pollground,http://pollground.com,s2006,Consumer,Online polls.,True,False,False
12,Cocoon,http://cocoon.com,w2019,Community,Bring your most important groups closer together,False,False,False
13,Keeper Tax,https://keepertax.com,w2019,,Automatic tax write offs for contractors,False,False,False
14,Replika,https://replika.ai/,w2015,Consumer,Replika is an AI friend that you can talk to designed to make you feel better,False,True,False
15,Coursedog,http://coursedog.com,w2019,B2B,Enterprise Resource Planning Software for Higher Education,False,False,False
16,Simmery,http://simmery.com,s2005,,,True,False,False
17,Metapacket,http://www.metapacket.com,s2016,Developer Tools,Metapacket is the first selective web gateway that stops malware by blocking non-human communication in corporate networks.,True,False,False
18,Drive Pulse,http://drivepulseapp.com,w2014,Hardware,Device tracks & monitors your car,True,True,False
19,Shout,http://useshout.com,s2014,,Real-Time Classifieds,True,False,False
20,Taali Inc,https://www.taalifoods.com/,w2019,Consumer,Taali is creating popcorn 2.0 from popped water lily seeds,False,True,False
21,Caviar,http://trycaviar.com,s2011,Marketplace,Uber for food.,False,False,False
22,Airboard,https://myairboard.com,w2020,,Whiteboard for remote work and remote learning,False,True,False
23,Lingt,https://www.lingt.com/,s2009,Education,Lingt provided a web-based platform for learning languages leveraging gaming mechanics and spaced repetition.  It was acquired by dictionary.com at the end of 2010.,False,False,False
24,Sublime Black,http://sublimeblack.com,w2019,Security,Automating Cyber Security Incident Response Through Artificial Intelligence,False,False,False
25,Inscribe,https://www.inscribe.ai/,s2018,Artificial Intelligence,API to identify fraudulent documents.,False,False,False
26,CureSkin,http://cureskin.com,s2017,Consumer,AI dermatologist for India,False,False,False
27,Likebetter,http://likebetter.com,s2006,Consumer,,True,False,False
28,Plexus,http://plexus.im,s2018,Virtual Reality,High-performance gloves for VR and AR,False,False,False
29,PreDxion Bio,http://www.predxionbio.com,s2017,Hardware,Fast blood test to save the lives of ER patients,False,False,False
30,Tule Technologies,http://tuletechnologies.com,s2014,B2B,"Tule helps farmers make irrigation decisions. Our hardware sensor provides growers with field-scale crop water use measurements, crop water stress measurements, applied irrigation measurements, and irrigation recommendations.",False,False,False
31,Ardis AI,http://www.ardis.ai,w2020,,Building the foundations for Artificial General Intelligence.,False,True,False
32,CodeNow,http://codenow.org,w2014,Education,Our mission is to diversify the talent pipeline of students who pursue computer science and technology. We do this by providing free out-of-school computer programming training to students hosted at tech companies.,False,False,False
33,Swipe,http://getswipe.com,w2020,,Brex for Africa. First credit card for African SMBs.,False,False,False
34,Volk Wireless,http://volkfi.com,w2019,Consumer,,False,False,False
35,Thinkature,http://thinkature.com,s2006,Consumer,,True,False,False
36,Edyn,http://edyn.com,w2014,Hardware,Nest for lawn and garden,True,False,False
37,Encarte,http://encarte.io,w2019,B2B,Encarte is building 1-click checkout for all online stores.,False,False,False
38,Community Phone Company,https://www.communityphone.org/,w2019,Consumer,"Affordable, friendly, and secure cell phone service with nation-wide coverage.",False,False,False
39,Windsor,https://windsor.io,w2019,Developer Tools,One place for all your user data,False,False,False
40,Probably Genetic,https://www.probablygenetic.com/,w2019,Healthcare,We sell direct-to-consumer DNA tests to diagnose rare genetic diseases.,False,True,False
41,Coub,http://coub.com,s2016,Consumer,"Coub is YouTube for video loops. You can take any video from YouTube, Facebook or upload your own. Trim it to the best part, mix it with other videos or add a soundtrack",True,False,False
42,Instrumentl,https://www.instrumentl.com,s2016,Enterprise,Instrumentl automates grant discovery and tracking for nonprofits.,False,True,True
43,PreFlight,http://preflight.com,w2019,Developer Tools,Automated Software Testing,False,False,False
44,Lumos,https://www.lumosmd.com,w2019,Healthcare,,False,True,False
45,StyleBee,http://stylebee.com,s2015,Consumer,marketplace for beauty services delivered at the convenience of clients' location and cheaper than salons' services,False,True,True
46,Precognate,http://precognate.com,s2008,,,True,False,False
47,Zinc Platform,http://www.zincplatform.com,s2017,B2B,Insurance Distribution Infrastructure,True,False,False
48,Sling Health,https://slinghealth.com/,s2019,Healthcare,Tech-enabled remote clinical care teams for healthcare organizations.,False,True,False
49,Apartio,http://www.apartio.com.br,w2020,,We provide short term rentals for business travelers in Latin America. ,False,False,False
50,Simmer,https://www.usesimmer.com,s2019,Consumer,We do reviews for dishes. Our app helps users find the very best dishes for delivery. Our vision is to be the first place people go when ordering delivery. ,True,True,False
51,Memora Health,https://memorahealth.com,w2018,Healthcare,Memora Health helps healthcare organizations standardize and automate patient communication.,False,False,False
52,HER,http://weareher.com,s2015,Consumer,"HER helps lesbian, bisexual and queer people meet each other",False,True,True
53,PerShop,https://www.pershop.app,w2019,Consumer,Your personal clothing store!,True,False,False
54,Elph,https://elph.com,w2019,,Acquired by Brex. Building digital payments infrastructure.,False,False,False
55,Medisas,http://medisas.com,w2013,B2B,Medisas builds workflow & collaboration software for hospitals.,False,False,False
56,Trade,http://www.tradeghana.co,w2017,Marketplace,We're building Africa's Commodity Exchange. ,True,False,False
57,VotingWorks,https://voting.works,w2019,Government,Non-profit building secure and affordable voting machines for US elections.,False,False,False
58,NavTrac,http://www.navtrac.com/,s2016,Hardware,Digitizing Container Logistics,False,False,False
59,Yummy Future,https://www.yummy-future.com/,s2019,Robotics,We are building an AI enabled robotic coffee shop.,False,False,False
60,Zynq,https://zynq.io,w2020,Other,Enterprise calendar built for efficient scheduling,False,False,False
61,Herald,https://www.heraldhq.com,s2019,Enterprise,"Herald is the best space for teams to collect, analyze, and collaborate on user feedback.",False,False,False
62,Beacons,https://beacons.ai/,s2019,Artificial Intelligence,The best mobile website builder for content creators,False,False,False
63,Piggy,https://piggy.co.in,s2017,Fintech,"App for Indians to make investments in mutual funds, manage their investment portfolios, and save for retirement. (Vanguard for India)",False,False,False
64,Names & Faces,http://www.namesandfaces.com,s2018,Enterprise,"Fast, built for purpose, visual lists of the people in your organization.",False,False,False
65,Battlecard,https://battlecard.com?yc,w2020,Other,Battlecard helps teams organize and practice their playbook.,False,False,False
66,Supermedium,https://supermedium.com/,w2018,Virtual Reality,Building VR utilities.,False,False,False
67,Bumpline,https://bumpline.com/,s2017,Marketplace,Captain Tailor is the Uber for tailoring. ,False,True,False
68,Wren,https://projectwren.com/,s2019,B2B,Wren is a monthly subscription to offset your carbon footprint,False,True,False
69,Gaiascope,http://gaia-scope.com,s2019,Energy,Gaiascope is an energy quant fund that trades electricity.,False,True,True
70,Gen1E Lifesciences,https://www.gen1elifesci.com,s2019,Biotech,GEn1E is a platform for curing inflammation and age-related diseases,False,True,False
71,Shipper,https://shipper.id,w2019,Transportation,,False,False,False
72,Honeylove,https://www.honeylove.com,s2018,Consumer,Honeylove makes undergarments and apparel for women that enhance body shape and support posture. ,False,True,True
73,Elpha,https://elpha.com,s2019,Consumer,Where women in tech talk candidly online,False,True,True
74,Flowdash,https://flowdash.com,w2020,Security,Quickly build internal tools to track and execute human-in-the-loop workflows. ,False,False,False
75,Cartcam,https://www.cartcam.com,w2017,Consumer,"Cartcam is an app for opinionated, deal-seeking shoppers.  It gives people discounts for creating short video reviews.",True,False,False
76,Fixed,http://getfixed.me,s2014,Consumer,iPhone app to fight your parking tickets.,True,False,False
77,BloomThat,http://bloomthat.com,s2013,Consumer,Uber for Flowers.,False,False,False
78,onederful,http://www.onederful.co,w2018,,Dental Insurance API,False,True,False
79,LendEDU,https://lendedu.com,w2016,Consumer,LendEDU is a marketplace for consumer financial products.,False,False,False
80,Juno College of Technology,http://junocollege.com,s2019,Education,Juno is the technical university of the future.,False,True,True
81,Mistro,https://mistro.io,w2020,Other,Benefits + perks for distributed teams,False,True,False
82,Heart Aerospace,http://www.heartaerospace.com,w2019,Drones,"Heart makes electric airplanes with an all-electric range of 250 miles. We have support and grants from the Swedish government, and LOIs from Scandinavian Airlines (SAS), BRA and Wideroe for 86 planes, worth $1.6B.",False,False,False
83,Valienta,https://valienta.com,w2020,Marketplace,"Valienta software makes it easy for any retailer to create, manage and deploy direct selling teams in Latin America. The channel already sells $27 Billions worth of goods through a sales force of 13 million sellers aided by no software.",False,False,False
84,Alude,https://www.alude.com.br/,w2020,Other,"We offer free software that automates bureaucracy for real-estate brokers in LatAm, and monetise by selling mortgages and insurance to their customers.",False,False,False
85,ShopWith,https://www.shopwith.co,s2018,Marketplace,ShopWith is mobile QVC for GenZ.,False,True,False
86,Synkrino Biotherapeutics,http://www.synkrino.bio,s2018,Biotech,"Synkrino Bio's AIDE Engine discovers and develops novel drug targets directly from the immune system of patients. The AI + Immunology Discovery Engine has identified two novel drug targets, for which we are developing therapeutics for the clinic. ",False,False,False
87,Popular Pays,http://popularpays.com,w2015,Consumer,Software for collaborating with content creators and influencers ,False,False,False
88,PopSQL,https://popsql.com,s2019,Developer Tools,SQL editor for teams,False,False,False
89,nextmv,https://nextmv.io,w2020,Transportation,Dev platform for quickly building and testing logistics algorithms.,False,True,False
90,1build,https://1build.com/,w2020,,1build helps builders win bids by converting blueprints into material shopping lists and cost estimates with machine intelligence.,False,False,False
91,FundersClub,https://fundersclub.com/,s2012,Fintech,Online VC,False,False,False
92,Glimpse,https://joinglimpse.com,w2020,Community,"2 minute, one-on-one, video chats with your friends, and friends of friends.",False,True,False
93,Proof Trading,https://prooftrading.com,s2019,,Institutional equities broker-dealer,False,True,False
94,Suiteness,https://www.suiteness.com,s2016,Consumer,Book guaranteed connecting rooms and suites at hotels,False,False,False
95,VOIQ,http://voiq.com,s2015,B2B,Conversational AI VoiceBots for Calling,False,False,False
96,Nonu,https://nonucare.com/,s2019,Healthcare,We deliver hair loss medicines for Indian men on a subscription basis.,False,False,False
97,Middesk,http://www.middesk.com,w2019,Enterprise,Background checks on business entities.,False,False,False
98,Cratejoy,http://cratejoy.com,s2013,Consumer,Cratejoy is the platform for subscriptions,False,False,False
99,CareMessage,http://caremessage.org,w2014,B2B,Patient engagement using text messaging,False,True,False
100,Ultralight,https://ultralig.ht,w2019,Developer Tools,The Future of Cross-Platform Desktop Apps,False,False,False
101,Cloosiv,http://www.cloosiv.com,s2019,Marketplace,"Cloosiv is an order-ahead app for independent coffee shops, cafÃ©s and bakeries.",False,False,False
102,Shef,https://www.shef.com,w2019,Marketplace,Airbnb for Home-Cooked Food,False,False,False
103,AI Insurance,https://www.aiinsurance.io,w2019,B2B,"AI Insurance builds cloud-based claims management software for the property and casualty insurance industry. 90% of the industry doesn't have decent software to handle their claims, and we provide it at a subscription price they can afford.",False,False,False
104,Segmed,https://segmed.ai,w2020,Healthcare,"High quality data for medical research, starting with AI Radiology.",False,True,False
105,Medinas Health,https://www.medinas.com/,s2018,Healthcare,Medinas helps hospitals manage their inventory and buy and sell their used equipment.,False,True,False
106,Escher Reality,http://www.escherreality.com/,s2017,Developer Tools,The backend for Augmented Reality.,False,True,False
107,Alana,https://www.alana.jobs,s2019,Marketplace,Helping large companies in LATAM hire blue-collar workers ,False,False,False
108,Handl,https://handl.ai/,w2020,Other,"Handl converts documents (invoices, income stabs, custom forms, etc.)  into structured data through simple API",False,False,False
109,nplex biosciences,https://www.nplexbio.com,w2020,Biotech,nplex uses nanotechnology to measure proteins at scale.,False,False,False
110,Plivo,http://plivo.com,s2012,B2B,APIs for Voice calls and SMS,False,False,False
111,GovPredict,http://govpredict.com,s2015,Enterprise,Bloomberg for government data.,False,False,False
112,Cue,http://cueup.com,w2010,Consumer,,False,False,False
113,Riya Collective,http://riyacollective.com,w2020,,"Riya Collective is building the first global marketplace for ethnic goods, starting with renting Indian clothing for wedding guests in the US",False,True,True
114,Grain,https://trygrain.com/,w2020,,Grain transforms the debit card you already have into a credit card by linking it to a line of credit based on your cash flow. ,False,False,False
115,RescueTime,http://rescuetime.com,w2008,Consumer,Ridiculously Easy Time Management,False,False,False
116,NanoNets,http://nanonets.com,w2017,B2B,Easy to use Machine Learning API. Needs 10 times less data.,False,False,False
117,Vori,https://www.vori.com,w2020,Marketplace,Vori is a b2b wholesale app that streamlines ordering for supermarkets and wholesalers.,False,False,False
118,Globe,https://www.globeliving.com/,s2019,Marketplace,,False,False,False
119,Streak,http://streak.com,s2011,B2B,"Streak transforms Gmail into a customizable CRM and process management tool. Our products service thousands of businesses, weâre growing fast, weâre profitable and weâre still a small team.",False,False,False
120,Blockspring,http://blockspring.com,s2014,B2B,Blockspring automates data collection by connecting your favorite tools to APIs.,False,False,False
121,Nomad Rides,http://www.nomadmoments.com,s2019,Transportation,"Nomad is the first commission free rideshare service. Instead of a 40% commission (like Uber and Lyft), our drivers make 20% more, while riders pay 20% less. Nomad then monetizes on a monthly subscription, advertisements, and in-car vending machines.",False,False,False
122,Verge Genomics,http://vergegenomics.com,s2015,Biomedical,We find drugs to treat brain diseases 1000x more cheaply and quickly,False,True,False
123,Voodoo Manufacturing,http://www.voodoomfg.com,w2017,B2B,Digitally-manufactured medical devices. ,False,False,False
124,Make School,http://www.makeschool.com,w2012,Education,"Make School is redesigning college for the 21st century. Students learn liberal arts and computer science, pay tuition as a percentage of earnings, and graduate to jobs at YC companies.",False,False,False
125,Cowlar,http://www.cowlar.com,w2017,B2B,"Fitbit for dairy cows. Farms use cowlar's alerts & recommendations to improve dairy margins by 30%. We charge $3 / month per cow for the service. 

We are  IoT & machine learning experts solving a real problem for dairy farms.  ",True,False,False
126,Shone,http://www.shone.com/,w2018,Robotics,Shone makes existing cargo ships autonomous through retrofit.,False,False,False
127,Room Service,https://roomservice.dev,s2019,Healthcare,Real time collaboration as a service. ,False,False,False
128,Carrot Fertility,https://www.get-carrot.com/,s2017,Enterprise,Customized fertility benefits for modern companies. ,False,True,False
129,Sliced Investing,,s2014,Fintech,Crowdfunding for hedge funds,False,False,False
130,Wink Health,http://winkhealth.com,w2015,Biomedical,The digital sleep clinic,False,False,False
131,InnoVein,http://Innoveinmedical.com,w2016,Hardware,We cure intractable leg wounds with a replacement valve for veins. ,False,False,False
132,SendBird,https://sendbird.com,w2016,B2B,SendBird is the world's no1. chat API for mobile apps and websites.,False,False,False
133,Adla,https://adla.style,w2020,Marketplace,Lets college girls try on clothes at home for free.,False,True,False
134,Listle,https://listle.io,s2019,Media,Listle allows people to listen to the best articles on the Internet. ,False,True,False
135,Corvus Robotics,http://www.corvus-robotics.com,s2018,Robotics,Autonomous drones to help warehouses scan inventory.,False,False,False
136,Tap to Learn,http://taptolearn.com,w2012,Consumer,Games For Education,False,True,False
137,Y Combinator,https://www.ycombinator.com,s2005,,Not your average fixed point combinator.,False,,
138,Shopagram,http://shopagram.co,w2014,Consumer,Next Generation Home Shopping Network,False,False,False
139,HelpWear,http://helpwear.ca/,s2017,Hardware,,False,False,False
140,Aptible,https://www.aptible.com,s2014,B2B,Security Management and Compliance for Developers,False,False,False
141,Demand Curve,https://www.demandcurve.com,s2019,Education,Demand Curve trains startups in growth marketing and vets growth agencies for referrals.,False,False,False
142,Swapbox,http://swapbox.com,w2013,Consumer,Stop missing deliveries. Ship to Swapbox and pick up at our kiosks.,True,False,False
143,Acunote,http://acunote.com,w2011,Enterprise,,False,False,False
144,Binks,https://getbinks.com/,s2019,Marketplace,Convenient made-to-measure tailoring services for Indian women,False,True,False
145,Hype and Vice,https://www.hypeandvice.com/,s2019,,Fashionable college branded apparel for women.,False,True,True
146,Billforward,http://billforward.net,s2014,Enterprise,"Subscription billing, rate plan management and analytics as a service. We help you optimise your product rate plans, if you have a subscription based offering we can help!",False,False,False
147,Duffel,https://duffel.com/,s2018,B2B,"APIs for searching, booking and managing flights",False,False,False
148,Shred Video,https://shredvideo.com,s2015,Consumer,"Shred Video builds automated video & photo systems that allow adventure tour operators to create and sell cinematic, shareable videos to their customers.",False,False,False
149,Statwing,http://statwing.com,s2012,B2B,"Dead simple statistical analysis software. Like R or SPSS but easy to use.

Acquired by Qualtrics in May 2016.",False,False,False
150,Carupi,https://www.carupi.com/,w2020,Marketplace,"Carupi is a managed P2P marketplace for used cars, very similar to Airbnb, reinventing the archaic experience of things such as Craigslist or car dealers through a transparent, easy and safe platform, similar to what Airbnb did to home rentals.",False,False,False
151,Perlara,http://perlara.com,w2016,Biomedical,Perlara: n-of-1 for all,False,False,False
152,StatusPage,http://statuspage.io,s2013,B2B,The best way to communicate with users around downtime.,False,False,False
153,Standard Treasury,http://standardtreasury.com,s2013,Fintech,Banking APIs; acquired by Silicon Valley Bank in August 2015,False,False,False
154,FeaturePeek,https://featurepeek.com,s2019,Developer Tools,Supercharged deployment previews for all.,False,False,False
155,Atrium,http://www.atrium.co,w2018,B2B,Modern law firm for startups powered by proprietary technology,False,True,False
156,Linkana,https://www.linkana.com,w2020,Other,Linkana is a Compliance-driven Procurement software for companies in Latin America.,False,False,False
157,Snapdocs,http://snapdocs.com,w2014,B2B,Snapdocs powers homeownership.,False,False,False
158,DeepSource,https://deepsource.io/,w2020,Developer Tools,DeepSource finds and fixes issues during code reviews.,False,False,False
159,"Lucy Goods, Inc",https://lucy.co/,w2018,,"Lucyâs mission is to reduce tobacco-related harm to zero. We provide next-generation nicotine products, with just pure nicotine and food-grade ingredients. We provide a cleaner, more convenient alternative to the products on the market today.",False,False,False
160,FollowUpThen,https://www.followupthen.com/,s2017,Developer Tools,FollowUpThen is an email-based personal assistant that sends you exactly what you need at exactly the right moment to get something done.,False,False,False
161,Comradery,https://comradery.com,w2019,B2B,White-label Bookface for companies and communities!,False,False,False
162,Prompt,https://www.getprompt.app/,s2019,Artificial Intelligence,Helping busy professionals understand and maintain their relationships,False,False,False
163,Meetyu,http://meetyu.com,s2007,,,True,False,False
164,Netomi,https://netomi.com,w2016,B2B,Self-Driving Customer Care,False,False,False
165,Lattice,https://lattice.com,w2016,B2B,Modern performance management software. ,False,False,False
166,Starsky Robotics,https://www.starsky.io/,s2016,Hardware,"Driverless Trucks, for real.",True,False,False
167,Heyday Health,http://heyday.health,w2018,B2B,Elite nutrition coach in your pocket for $5 a day,True,False,False
168,Jido Maps,https://www.jidomaps.com,w2018,Developer Tools,A lightweight API for persistent augmented reality.,False,False,False
169,SannTek Labs,https://www.sannteklabs.com/,s2019,Hardware,We make a breathalyzer for cannabis.,False,False,False
170,Scentbird,http://scentbird.com,s2015,Consumer,Scentbird is Netflix for perfume + a luxury fragrance subscription service that sends you a 30-day supply of a designer fragrance of your choice for $14.95/month.,False,True,False
171,Salt Security,https://salt.security/,w2016,Enterprise,Salt detects and prevents zero-day API attacks with the power of AI. Deploys in minutes. No configuration required. Forever.,False,False,False
172,Withfriends,https://withfriends.co,w2019,Marketplace,Withfriends runs membership programs for small businesses.,False,True,False
173,Fibo,http://www.fiboapp.com,w2017,Enterprise,"Scheduling, invoicing and financial insights for field teams",True,False,False
174,Taobotics,http://www.taobotics.com,w2019,Robotics,Autonomous robots for retails. ,False,False,False
175,Zip Phone,http://zipphone.com,s2014,Consumer,Whatsapp for voice,False,False,False
176,Trexo Robotics,http://trexorobotics.com,w2019,Robotics,"Wearable robots to help people walk, starting with children with Cerebral Palsy.",False,False,False
177,WeatherCheck,https://www.weathercheck.co/,w2019,B2B,"WeatherCheck monitors properties for hail damage so that insurance carriers, mortgage companies, and property owners can take action.",False,False,False
178,Scaphold.io,https://scaphold.io,w2017,Developer Tools,The Universal API,False,False,False
179,ZumoDrive,http://zumodrive.com,s2007,Consumer,Media in the cloud,False,False,False
180,Perception Biosystems,https://www.perception.bio,s2018,Biotech,Democratizing gene therapy by reinventing its manufacturing and development.,False,True,False
181,Bottomless,https://bottomless.com,w2019,Hardware,Automatic home restocking using weight sensors to figure out the best time to re-order.,False,True,False
182,Revel,https://www.hellorevel.com/,s2019,Community,The modern community for women over 50,False,True,True
183,Bodyport,http://bodyport.com,s2015,Biomedical,Preventing heart disease.,False,True,False
184,Sketchbox,https://www.sketchbox3d.com,w2018,,Wordpress for AR & VR,False,False,False
185,Slinkset,http://slinkset.com,s2008,Consumer,Votable lists,False,False,False
186,CareLedger,http://careledger.com,s2015,B2B,CareLedger helps companies save money on healthcare expenses by aligning employee interest with the company's.,True,False,False
187,PostEra,https://postera.ai/,w2020,Biotech,Medicinal Chemistry as a Service powered by Machine Learning,False,False,False
