,name,url,batch,vertical,description,dead,has_ff,all_ff
1078,DroneBase,http://dronebase.com,w2015,Marketplace,"Dronebase saves businesses time, money, and lives by visualizing and analyzing their assets in our aerial data platform",False,False,False
1079,Koduco,http://koduco.com,s2010,Consumer,iPad games.,True,False,False
1080,Ridejoy,http://ridejoy.com,s2011,Marketplace,Long-distance carpooling marketplace. Shut down in early 2013.,True,False,False
1081,Crohnology,http://crohnology.com,s2012,Consumer,"We turn Patients into Researchers. 

We empower every patient with tools to contribute towards research for their cure.",False,False,False
1082,Cheddar,http://cheddar.io,w2015,Fintech,The Best Mobile Checking Account,True,False,False
1083,Viacycle,http://viacycle.com,s2012,B2B,"viaCycle makes simple, inexpensive bicycle sharing systems that allow automated bike rentals using a mobile phone. Think ZipCar for bikes, but more fun and even easier to use.
",True,False,False
1084,Omniref,http://omniref.com,w2015,Developer Tools,"Sticky notes for code.

(We're building a community-powered, code-based reference for programmers.)",True,False,False
1085,500Friends,http://500friends.com,w2010,Enterprise,the best loyalty and retention marketing partner for CMOs. ,False,False,False
1086,Release,https://www.releaseapp.io,w2020,Developer Tools,Environments as a service,False,False,False
1087,ToDesktop,https://www.todesktop.com,w2020,Developer Tools,"ToDesktop is an all-in-one platform for building and releasing desktop apps. We save companies months of development time by handling code signing, auto-updates, and native installers for Windows, Mac and Linux.",False,False,False
1088,Pixate,http://pixate.com,s2012,Developer Tools,Mobile application prototyping. Now part of Google.,False,False,False
1089,BitSample,,w2008,,,True,False,False
1090,Zillabyte,http://zillabyte.com,w2012,B2B,Palantir for sales people,True,False,False
1091,Vendr.com,http://www.vendr.com,s2019,Other,Vendr is the way companies buy software. ,False,False,False
1092,HYPHY,https://hyphy.tv,w2020,Marketplace,Hyphy is a marketplace where anyone can sell their original photos and videos to brands. ,False,False,False
1093,Matagora,https://www.matagora.com,s2019,,A platform allows online brands to instantly launch a physical storefront,False,False,False
1094,Kosh,https://getkosh.com,w2020,,Turn creditworthy blue-collar workers into micro-lenders for their community in India.,False,False,False
1095,Adventurous Co,http://adventurous.co,w2019,Consumer,Stories through physical locations.,False,True,False
1096,goDutch,https://godutchpay.in,w2020,,Group payments product which lets people pay together at any offline or online merchant,False,False,False
1097,7cups,http://7cups.com,s2013,Consumer,7 Cups is an emotional support service that matches up people that need support with active listeners and therapists.,False,False,False
1098,Able Jobs,https://ablejobs.co/,w2020,,"Job training app in India for roles in sales, support & marketing",False,False,False
1099,Hiptype,http://hiptype.com,s2012,B2B,"Hiptype is a marketing and analytics platform for eBooks. We can visualize where in a book readers most often annotate and highlight, and where they lose interest and stop reading.",True,False,False
1100,Ixiplay,http://,s2013,Hardware,"Engaging, expressive & Android hackable robot buddy for playful interaction.",True,False,False
1101,GoLinks,https://www.golinks.io,w2019,Enterprise,"Internal, human-readable short links for teams. GoLinks allows companies to increase productivity, by creating memorable short links for every internal company URL. These internal link systems have been a standard for productivity at major companies.",False,False,False
1102,Kopa,https://kopa.co,w2019,Marketplace,Find furnished apartments and compatible housemates for 1-12 months,False,True,False
1103,Hideout,http://findhideout.com,w2020,,A portfolio of delivery-only restaurant brands,False,True,False
1104,GoComm,http://gocomm.com,s2013,B2B,Mobile communications platform for teams working on live events,True,False,False
1105,GrubMarket,http://grubmarket.com,w2015,Marketplace,"GrubMarket is today's fastest-growing online farmers' market supplying fresh healthy local food directly from local farms and food producers, to local people, community and local companies, with affordable prices and convenient delivery.",False,True,False
1106,GIGI Benefits,http://www.gigibenefits.com,w2020,,"GIGI sells insurance + savings accounts to 150 million gig workers in India. We set aside a part of each pay check to cover insurance, expenses and retirement. Uber, Flipkart use GIGI to increase worker retention. Endgame: Neo-bank for 150mn Indians!",False,True,True
1107,Hungry Labs,http://hungrylabs.com,s2011,,Now part of Snaplayer.,False,False,False
1108,lvl5,http://www.lvl5.ai,w2017,B2B,HD maps for self-driving cars.,False,False,False
1109,Outbound,http://outbound.io,w2015,B2B,"Create automated messages -- email, iOS/Android push, SMS and web notifications -- that we send in real-time as users take actions inside your product, then measure the effect of each message on user behavior.",False,False,False
1110,Tajir,https://tajir.app,w2020,Marketplace,Marketplace for mom-and-pop stores in Pakistan to buy inventory.,False,False,False
1111,EPIC AEROSPACE,http://epic-aerospace.com,s2019,,A network of space-tugs that move satellites in space.,False,False,False
1112,treble.ai,https://treble.ai,s2019,Artificial Intelligence,,False,False,False
1113,Pepper,https://www.peppersf.com/,s2019,,"Nutrition APIs that help health, food, insurance, and technology companies build better user experiences",False,False,False
1114,Bufferbox,http://bufferbox.com,s2012,Consumer,"The future of package delivery. We are building a network of automated self-serve kiosks that allow consumers to receive parcels 24/7 from convenient locations. Say goodbye to failed deliveries!

Acquired by Google 11/30/2012",False,False,False
1115,Explo,https://explo.co/,w2020,,Data exploration and analysis without SQL,False,False,False
1116,Expo,https://expo.io,s2016,Developer Tools,"Expo brings together the best of web (development speed, fast iteration cycles, easy deploys, and automatic cross-platform support) and the performance and user experience of native apps. Let's talk if you're planning to build a mobile app.",False,False,False
1117,Metacode,https://metacode.app,s2019,Developer Tools,Better code search.,False,False,False
1118,Hogaru,https://www.hogaru.com/,w2017,B2B,Hogaru is a tech-enabled facility management platform in Latin America. ,False,False,False
1119,TrustedFor,https://www.trustedfor.com,s2019,,"TrustedFor is LinkedIn 2.0, where your professional profile features thoughtful recommendations from people who know you best, not just where you worked and where you went to school.",False,False,False
1120,WebCake,http://designly.com,s2013,B2B,Marketing people modify site.,True,False,False
1121,BookSolid,http://booksolid.com,w2012,B2B,BookSolid is the opentable for tour operators.,True,False,False
1122,Firsthand,http://shopfirsthand.com/,w2017,B2B,"Firsthand makes software-enabled, self-serve retail kiosks that carry high margin products. They average $120/kiosk in daily net revenue and cost $300/kiosk to make. Payback period is three days.",True,False,False
1123,Anchor Health,http://anchorhealth.com,w2016,Biomedical,"Modernizing home health care agencies with software, hardware, and operating systems",True,True,False
1124,New Incentives,http://www.newincentives.org,s2016,Consumer,Cash transfers that save lives.,False,True,False
1125,Ark,http://ark.com,w2012,Consumer,Ark organizes the world's social information. ,True,False,False
1126,Hey Healthcare,https://heyhealthcare.com,s2019,Healthcare,,False,True,False
1127,Deepnote,https://www.deepnote.com/,s2019,Developer Tools,A better data science notebook.,False,False,False
1128,Puzzl,https://www.joinpuzzl.com,s2019,Healthcare,API that automates instant payroll.,False,True,False
1129,Belvo,https://belvo.co/,w2020,,Financial API platform for Latam. The easiest way to connect bank accounts to an app,False,False,False
1130,StayQrious,https://StayQrious.com,w2020,Education,"StayQrious helps kids in India learn through online group classes, starting with coding.",False,False,False
1131,Project Wedding,http://projectwedding.com,w2006,Consumer,,False,False,False
1132,Chutney,http://chutneystore.com,w2020,,Amazon for the next 300m Indians who are coming online now.,False,True,False
1133,Meldium,http://meldium.com,w2013,Enterprise,Simple password & identity management for teams. Acquired by LogMeIn in August 2014.,False,False,False
1134,Avion,http://www.avionuav.com,w2020,,A drone delivery network which is live in Africa delivering medical supplies.,False,True,False
1135,Audobox,http://audobox.com,s2013,B2B,Audobox is a developer and user friendly tool for in-app feedback.,True,False,False
1136,SmartAsset,http://smartasset.com,s2012,Consumer,The easiest way to make and understand important personal finance decisions.,False,False,False
1137,Digi-Prex,http://www.digi-prex.com/,s2019,Healthcare,Subscription pharmacy for patients with chronic diseases,False,False,False
1138,LineLeap,https://lineleaptickets.com,s2019,Entertainment,"LineLeap is the OpenTable for bars and nightclubs, selling line-skip passes, pre-ordered drinks, general admission tickets, VIP table/bottle service and more at over 50 venues across the US.",False,False,False
1139,spotLESS Materials,https://www.spotlessmaterials.com,s2019,,"We make slippery coatings that repel sticky materials (liquid, sludge, bacteria, ice, mud, and beyond!)",False,True,False
1140,Bikanta,http://bikanta.com,s2014,Biomedical,Nano-diamonds for cancer detection,True,True,False
1141,The Custom Movement,https://www.thecustommovement.com,s2019,Community,Custom sneakers by independent artists.,False,False,False
1142,HauteDay,http://hauteday.com,s2014,Consumer,Gaming Meets Women's Shopping.,True,False,False
1143,LUS Brands,http://lusbrands.com,w2018,Consumer,Hair care products for curly hair. ,False,True,True
1144,Airship,https://www.airshiphq.com,w2018,Developer Tools,,False,False,False
1145,Closer Sports,https://closersports.com,w2019,,Mobile streaming platform connecting professional athletes with their fans.,True,False,False
1146,AccioJob,http://www.acciojob.com,w2019,Marketplace,AccioJob is a college job board in India where universities sign up to expose their students to the best companies.,False,False,False
1147,PagerDuty,http://pagerduty.com,s2010,Developer Tools,Notify you about server troubles.,False,False,False
1148,Taskade,https://www.taskade.com,s2019,,"Where Remote Teams Get Work Done. Taskade is building a real-time organization and collaboration tool for remote teams. Our goal is simple, to help teams get things done, faster and smarter. Get our apps ð Web, iOS, Android, Mac, Windows.",False,False,False
1149,ReelSurfer,http://reelsurfer.com,s2012,Consumer,Clip and share any video from any website.,True,False,False
1150,Mage,https://magemarket.com,w2019,Marketplace,The safest way to buy and sell collectibles ,False,False,False
1151,Medumo,https://www.medumo.com/,w2018,Healthcare,We manage patient instructions for hospitals,False,False,False
1152,Wing It,http://trywingit.com,w2018,Consumer,Discover weekend getaways near you via Facebook Messenger.,False,False,False
1153,Schoolable,http://schoolable.co,w2019,,Tuition collection service for K-12 private schools in Africa,False,True,False
1154,Precious,https://itunes.apple.com/us/app/baby-art-by-precious/id1103530261,w2018,Consumer,AI to curate your baby photos,False,False,False
1155,LVL6,http://lvl6.com,w2012,Consumer,We make mobile MMOs. ,True,False,False
1156,Hotspots,http://moki.tv,w2011,Consumer,"Real-time analytics (acq by TWTR, 2012)",False,False,False
1157,BarSense,http://kytephone.com,w2012,Consumer,Kid's first smartphone with web-based parental controls.,True,False,False
1158,UpLabs,https://www.uplabs.com,w2016,Marketplace,UpLabs is the #1 marketplace for designers & developers to find design resources.,False,True,False
1159,Iambiq Technologies,http://www.iambiqtech.com/,w2018,Artificial Intelligence,,True,True,True
1160,Vetcove,https://www.vetcove.com,s2016,B2B,"Vetcove is the largest B2B marketplace for the animal health supply chain. Veterinary hospitals can compare prices and what's in stock across vendors, and buy their pharmaceuticals, biologics, equipment, and supplies from one website.",False,False,False
1161,Instabug,https://instabug.com,w2016,Developer Tools,"Real-Time Contextual Insights for mobile apps. We're helping apps squash bugs in their beta apps and engage users in their production apps.If you're building a mobile app, we'd love to talk.",False,False,False
1162,Machine Zone,https://www.mz.com,w2008,Consumer,Mobile games,False,False,False
1163,Rentobo,http://rentobo.com,s2011,B2B,"The easiest way to find a tenant.

Rentobo is a tool that makes it easy for rental landlords and property managers to advertise their listings and accept rental applications online.",True,False,False
1164,Prodigal,https://prodigaltech.com/,s2018,,Collection Intelligence Software,False,False,False
1165,SendHub,http://sendhub.com,w2012,Enterprise,Simple Business SMS. SMBs to Large Enterprise.,False,False,False
1166,Rapportive,http://rapportive.com,s2010,Consumer,Add profiles to email.,False,False,False
1167,Switchboard,https://www.onswitchboard.com,w2019,Transportation,Truck Freight Marketplace,False,False,False
1168,Audiobeta,http://audiobeta.com,w2006,,,True,False,False
1169,SPATE,https://www.spate.nyc,s2018,B2B,Trends prediction for marketers,False,True,False
1170,Flytenow,http://flytenow.com,s2014,Consumer,Ride sharing for small planes,False,False,False
1171,"Screenleap, Inc.",https://screenleap.com,w2012,B2B,One-click screen sharing with installation-free viewing on all devices. Also available as a service through our API for companies that want to add screen sharing to their products.,False,False,False
1172,Sinovia Technologies,http://www.sinoviatech.com,w2017,Hardware,Flexible printed OLED displays.,False,True,False
1173,MightyQuiz,http://mightyquiz.com,w2008,Consumer,,True,False,False
1174,ARI (Augmented Radar Imaging),http://augmentedradar.com,s2018,Robotics,We do for radar (and other sensors) what computer vision does for cameras,False,False,False
1175,Kirkland North,http://kirklandnorth.com,w2008,Consumer,,True,False,False
1176,Joberator,http://joberator.com,w2008,Consumer,,True,False,False
1177,Eva Center,https://evacenter.com,s2018,Healthcare,Non-invasive and private breast cancer screening in under 10 min,False,False,False
1178,FriendSpot,https://apps.apple.com/us/app/id1465319546,s2017,Consumer,"FriendSpot is a social app studio focused on helping teens spend less time scrolling through a feed, and more time meaningfully connecting. ",False,False,False
1179,Couple,http://couple.me,w2012,Consumer,"App that connects two phones and creates a private
timeline to share things with your girlfriend/boyfriend. It's
somewhere between a Facebook timeline for your relationship, and SMS,
so you have a more personal way to communicate.",True,False,False
1180,Inokyo,https://www.inokyo.com,s2018,Consumer,We bring physical stores to the digital age with cashierless checkout.,False,False,False
1181,Fabricly,http://fabricly.com,w2010,Marketplace,,True,False,False
1182,Karat,http://trykarat.com,w2020,,,False,False,False
1183,Data Marketplace,http://datamarketplace.com,w2010,B2B,,True,False,False
1184,Fithub,http://fithub.com,w2010,B2B,,True,False,False
1185,Virtualmin,http://virtualmin.com,w2007,Developer Tools,,False,False,False
1186,TrustEgg,http://fidoosh.com,w2011,Fintech,Trust funds.,True,False,False
1187,MDacne,https://www.mdacne.com/,w2017,Consumer,An app that analyzes your selfie and delivers custom acne treatment. ,False,False,False
1188,College Pulse,https://collegepulse.com/,s2018,Community,Research and analytics company focused on college students.,False,False,False
1189,Userfox,http://userfox.com,s2011,B2B,User retention as a service.  Drip email,True,False,False
1190,Visly,https://visly.app,w2019,Developer Tools,Build React components visually,False,False,False
1191,Bagaveev Corporation,http://bagaveev.com,w2015,Hardware,Launch small satellites,False,False,False
1192,Nettrons,https://www.nettrons.com,w2019,Artificial Intelligence,AI candidates sourcing for recruiters,False,True,True
1193,Jellyfish Art,http://jellyfishart.com,w2012,Consumer,,True,False,False
1194,PocketSuite,https://pocketsuite.io,w2016,B2B,PocketSuite is the app for anyone with clients.,False,False,False
1195,MicroHealth,http://microhealth.com,s2015,Biomedical,Digital platform to track and predict disease,False,False,False
1196,SOMATIC,http://getsomatic.com,w2020,Robotics,Bathroom cleaning robots for office buildings. ,False,False,False
1197,Blue Frog Gaming,http://bluefroggaming.com,s2007,Consumer,,False,False,False
1198,CoderWall,http://assemblymade.com,w2012,B2B,,False,False,False
1199,FamilyLeaf,http://familyleaf.com,w2012,Consumer,Help families stay in touch,True,False,False
1200,Glider,http://glider.io,w2012,Consumer,We filter distracting emails away from your inbox.,True,False,False
1201,Minefold,http://minefold.com,w2012,Developer Tools,Simple multiplayer game servers.,True,False,False
1202,Elemeno Health,http://elemenohealth.com,s2016,Enterprise,"Point of care microlearning, as a service",False,False,False
1203,Airshared,http://getcycle.com,s2012,Marketplace,TBD,True,True,False
1204,SolidStage,http://solidstage.com,w2012,Developer Tools,"Sysadmin as a service. We make deploying, configuring, monitoring, and scaling in the cloud simple. ",True,False,False
1205,Mimir,https://mimirhq.com,s2015,Education,"A platform for STEM courses featuring automated grading, plagiarism detection and analytics.",False,False,False
1206,PostHog,https://www.posthog.com,w2020,Developer Tools,"Open source product analytics. Self hosted, full underlying data access. Automatic event data capture.",False,False,False
1207,StackLead,http://stacklead.com,w2014,B2B,Lead intelligence as a service. We want to be your personal lead consultants--email us at founders@stacklead.com and we'll help you generate and prioritize leads.,False,False,False
1208,MixerBox,http://mixerbox.com,w2014,Consumer,Unified Music Player,False,False,False
1209,Abalone Bio,https://www.abalonebio.com,w2020,Biotech,We discover antibody drugs others can't,False,False,False
1210,Spire Law,https://spirelawfirm.com/,w2019,Artificial Intelligence,Tech enabled business and employment litigation law firm,False,False,False
1211,Shoobs,http://shoobs.com,w2014,Consumer,We help you find and book tickets to great entertainment events that match your taste.,False,True,True
1212,OrderAhead,http://orderaheadapp.com,w2011,Consumer,Order ahead for pickup,False,False,False
1213,Allo,https://www.allocommunity.com/,w2019,Community,Allo is an app that helps neighboring families meet and help each other out.,True,True,True
1214,Lockitron,http://lockitron.com,s2009,Hardware,Lockitron makes electronic locks you can control locally from your phone or remotely through the internet.,False,False,False
1215,And Comfort,http://andcomfort.com,s2018,Consumer,And Comfort is a direct to consumer fashion brand for plus-size women. We make plus-size basics and sell then online at andcomfort.com.,True,True,False
1216,Echo Locker,http://echolocker.com,s2013,Consumer,Android lock screen,False,True,False
1217,Semantix,https://www.semantix.ai,s2017,Enterprise,AI for medical billing,False,False,False
1218,Zeo Auto,http://www.zeoauto.com/,w2020,Transportation,Route Planning and fleet management software.,False,False,False
1219,Public Recreation,http://www.publicrecreation.com,s2018,Consumer,"A new type gym, 100% outdoors, offering unlimited fitness classes for $60/month.",False,True,False
1220,Wakie,http://www.wakie.com,w2016,Consumer,A social app for phone calls. Express yourself and make real friends.,False,False,False
1221,Experiment,http://experiment.com,w2013,Marketplace,crowdfunding platform for science,False,True,False
1222,Demodesk,https://demodesk.com,w2019,B2B,Intelligent online meeting tool for inside sales & customer success,False,True,False
1223,Abacus,https://abacusfi.com/,s2018,,The modern platform for legal and compliance workflows.,False,False,False
1224,PayTango,http://paytango.com,w2013,B2B,Simple invoicing,True,True,False
1225,Rejuvenation Technologies Inc.,https://www.rejuvenationtech.com/,s2019,Biotech,We extend telomeres to extend the human health span,False,False,False
1226,Protonet,https://protonet.info,w2016,Hardware,"Protonet provides the easiest way for a small business to run its own private cloud. With beautiful (orange) devices and under 3 minutes of setup time!

We aim to democratize cloud infrastructure.",False,False,False
1227,Weave,http://weave.in,s2014,Consumer,AI-assisted professional networking.,True,False,False
1228,CircuitHub,https://circuithub.com,w2012,B2B,Electronics factory automation,False,False,False
1229,Noora Health,http://noorahealth.org,w2014,B2B,Training patients and their families with health skills to improve outcomes and save lives.,False,True,True
1230,Pulse,http://www.getpulse.care/,w2017,B2B,Electronic Medical Records for India,True,False,False
1231,Allotrope Medical,http://www.allotropemed.com,s2018,Healthcare,Advancing surgical precision through safe electrical stimulation. ,False,False,False
1232,URX,http://urx.com,s2013,B2B,Mobile ads that users like. Acquired by Pinterest in May 2016.,False,False,False
1233,SpoonRocket,http://spoonrocket.com,s2013,Consumer,Meals Delivered in 10 Minutes,True,False,False
1234,The Podcast App,https://podcast.app/,w2018,Consumer,"Discover podcasts that will make you 1% better, every day",False,False,False
1235,Apto,http://shiftpayments.com,s2014,Fintech,API platform for partners to issue branded debit and credit cards to their end users.,False,True,False
1236,Whirlscape,http://getdango.com,w2014,Consumer,Mobile keyboards + emoji + deep learning. We make Dango. We also made the Minuum keyboard.,True,False,False
1237,Psylaris,http://www.psylaris.com/,w2018,Healthcare,"We use VR to automate mental health techniques for B2C. Our mobile VR app reduces negative mood, anxiety, and stress, without the need for a therapist. Using insights from neuroscience and psychology, we improve your mental state and performance.",True,False,False
1238,BioRender,https://www.biorender.com,w2018,Enterprise,The Adobe Creative Suite for Life Sciences,False,True,False
1239,WheelStreet,https://www.wheelstreet.com/,s2017,Marketplace,WheelStreet is a Motorbike rental marketplace that connects motorcycle rental vendors in India with riders. The user can book any motorcycle in 30 cites across India through our platform. User can compare bikes on the basis of location and reviews.,True,True,False
1240,View3,http://view3.com,w2007,,,True,False,False
1241,OwnLocal,http://ownlocal.com,w2010,B2B,"OwnLocal automates marketing for over 129,000 SMBs through 3,300 local media partners in North America, Australia and UK.",False,False,False
1242,MailTime,http://mailtime.com,w2016,Consumer,MailTime (Measurable) turns transactional email receipts into actionable consumer insights for investors and brands.,False,False,False
1243,Turing Labs Inc.,http://www.turingsaas.com,w2020,,Turing AI helps consumer brands like Dove soap develop better product formulations faster. ,False,False,False
1244,Compound,https://withcompound.com/,s2019,,Compound does financial management for people who work at and invest in technology companies. ,False,False,False
1245,Soomgo,https://soomgo.com,w2017,Marketplace,"Soomgo is Thumbtack for Korea/Asia. We are a marketplace that helps local service providers such as movers, piano teachers, and wedding planners find new customers.",False,False,False
1246,Pearl,https://getpearlcoffee.com/,w2017,Consumer,The future of office coffee.  Keurig convenience meets cafe quality. ,False,False,False
1247,Neema,http://getneema.com/,w2017,Fintech,"Neema is an app for unbanked workers, which provides a checking account, a debit-card and instant remittance to 90 countries, all for $3 a month.",False,False,False
1248,NeoWize,http://www.neowize.com,s2016,B2B,NeoWize created a new type of machine learning algorithm and uses it to improve personalization algorithms in e-commerce sites.,False,False,False
1249,"Lively, Inc.",https://livelyme.com,w2017,Consumer,A modern health savings account (HSA) for employers and individuals. ,False,False,False
1250,Floobits,http://floobits.com,s2013,B2B,"Real-time collaborative editing in the browser with support for Sublime, Vim, and Emacs. Focused right now on remote pair programming.",True,False,False
1251,BuildScience,http://www.buildscience.com/,w2015,Enterprise,"The operating system for commercial buildings. With little to no additional hardware, we make buildings smarter by connecting to HVAC, lighting, metering, security and more. ",False,True,False
1252,Feather,http://livefeather.com,s2017,Consumer,Redefining furniture rental,False,False,False
1253,Datamode,http://www.datamode.com,w2019,Developer Tools,Datamode (datamode.com) is a tool for engineers to instantly diagnose data pipeline failures.,True,False,False
1254,Manycore.io,http://www.manycore.io,w2019,Developer Tools,ManyCore.io speeds up computer programs by spreading them automatically onto several cores,False,False,False
1255,Senic,http://senic.com,s2013,Hardware,"Simple Controls for Sonos, Philips Hue and other Smart Home products",False,False,False
1256,Automate Ads,http://kuhcoon.com,w2015,B2B,"On a mission to programmatically automate, optimize, and unify your digital advertising campaigns with incredible software.
",True,False,False
