,name,url,batch,vertical,description,dead,has_ff,all_ff
1600,Podium,https://podium.com,w2016,B2B,Podium is an interaction platform for local businesses.,False,False,False
1601,Boom,https://boomsupersonic.com/,w2016,Hardware,Mainstream supersonic passenger airplanes,False,False,False
1602,Drip Capital,http://dripcapital.com,s2015,Fintech,Drip is a digital trade finance startup enabling credit access to small businesses in emerging markets  ,False,False,False
1603,JuziBot,https://www.juzibot.com/,w2019,Artificial Intelligence,"Intercom for WeChat, help companies to acquire,  engage, retain customers via WeChat.We built a customer management tool for WeChat. It provides a customer support ticket, includes a chatbot, and provides analytics to the business. ",False,True,False
1604,Cuboh,https://www.cuboh.com,s2019,B2B,"Cuboh helps restaurants use several delivery platforms like Doordash, Postmates, UberEats, and more by bringing them all to one system (ours), and integrating it with POS systems.",False,False,False
1605,ZeroCater,http://zerocater.com,w2011,B2B,ZeroCater is the #1 way companies provide family-style meals for their employees.,False,False,False
1606,Shape (ShapeScale),https://shapescale.com,s2015,Hardware,ShapeScale is a personal 3D scanner and fitness tracker that digitizes your body in photorealistic 3D. Visualize on your phone where exactly you gain muscle or lose mass. Now on pre-order on shapescale.com! ð#fitness #health #hardware #IoT,False,False,False
1607,Deel,https://www.letsdeel.com/,w2019,B2B,Payroll for remote teams,False,True,False
1608,Apollo,http://apollographql.com/,s2011,Developer Tools,"We make Apollo, the leading GraphQL implementation. (We are also the team that built Meteor, the JavaScript framework.)",False,False,False
1609,Kickpay,https://kickpay.com,w2015,B2B,A platform to finance inventory for e-commerce companies.,False,False,False
1610,NURX,https://www.nurx.com/,w2016,Consumer,Nurx is the fastest way to get oral contraceptives and Truvada for PrEP. ,False,False,False
1611,CodeCombat,https://codecombat.com,w2014,Education,Game that teaches computer science to middle and high school kids.,False,False,False
1612,Bitrise,https://www.bitrise.io,w2017,Developer Tools,Hosted Continuous Integration and Delivery for mobile apps,False,False,False
1613,Clipboard Health,http://clipboardhealth.com,w2017,Education,We connect nurses with jobs they love and information they can trust. ,False,True,True
1614,Cofactor Genomics,http://cofactorgenomics.com,s2015,Biomedical,Cofactor is using RNA for early diagnosis of disease.,False,False,False
1615,Zapier,http://zapier.com,s2012,Developer Tools,The easiest way to automate your work,False,False,False
1616,tEQuitable,https://www.tEQuitable.com/,w2018,Diversity,tEQuitable's mission is to create work culture that works for everyone,False,True,True
1617,Cognition IP,https://www.cognitionip.com,w2018,Artificial Intelligence,First tech-enabled patent law firm.,False,False,False
1618,Goodcover,http://www.goodcover.com,s2017,Consumer,"Digital Co-op Renters Insurance = half the price, better coverage.",False,False,False
1619,FamPay,https://fampay.in,s2019,,Indiaâs first payments app for teenagers and their families. ,False,False,False
1620,Castle,https://castle.io,w2016,B2B,Castle analyzes user behavior to stop hackers,False,False,False
1621,Algolia,http://www.algolia.com,w2014,Developer Tools,Algolia offers a developer-friendly and enterprise-grade search API,False,False,False
1622,ExceptionALLY,https://growexceptionally.com/,s2018,Education,Affordable expertise for special needs parenting.,True,True,False
1623,OpenInvest,http://openinvest.com,s2015,Fintech,Technology-enabled asset manager providing ESG-focused investments.,False,False,False
1624,Prelim,https://prelim.com/,s2017,Fintech,"Prelim is simplifying the go-to-market digital originations process for banks, helping banks help people.",False,False,False
1625,Loop Health,http://www.loophealth.com,w2020,Marketplace,Modern & comprehensive health insurance plan for employees in India,False,False,False
1626,Token Transit,https://tokentransit.com,w2017,Enterprise,Payment processor for transit.,False,True,False
1627,Benepass,http://www.getbenepass.com,w2020,Marketplace,Benepass is the benefits card for startups and small businesses. We help companies offer tax-advantaged employee benefits and health/wellness perks through a smart debit card and mobile app.,False,True,False
1628,Figments,http://teamfigments.com,s2019,Entertainment,The next version of the WWE for esports. ,False,False,False
1629,Homestead,https://www.homestead.is/,w2020,,Homestead converts your unused space into a rental apartment.,False,False,False
1630,Dashworks,http://www.dashworks.ai,w2020,Other,The Fastest Internal Search For Teams,False,False,False
1631,Deep Meditate,https://deepmeditate.com,w2020,,"Deep Meditate is an app that helps you de-stress, sleep, and re-energize with personalized meditations",False,False,False
1632,FitnessAI,https://fitnessai.com,w2020,,App offering AI powered workout plans with anytime access to coaches,False,False,False
1633,Terusama,http://terusama.com,w2020,,,False,False,False
1634,Paneau,https://paneau.io,w2020,,Tablets inside Uber/Lyfts to advertise directly to riders,False,False,False
1635,Scout,http://scout.ml,w2020,Developer Tools,Dead simple CI/CD for machine learning teams.,False,False,False
1636,Glisten AI,http://glisten.ai,w2020,,ERP software for e-commerce,False,True,True
1637,Riot Security,https://tryriot.com/,w2020,Security,Practical phishing training for your team,False,False,False
1638,onetool,https://onetool.co/,w2020,Marketplace,"With onetool startups get all the software they need to run their business with just one single subscription: Access to 60+ tools, one invoice, and one centralized login/provisioning.",False,False,False
1639,Datree,https://datree.io,w2020,Developer Tools,Datree helps engineering teams implement development & security policies in Git workflows on every commit,False,False,False
1640,Eze,https://www.ezewholesale.com/,w2020,Marketplace,Eze is a commodities exchange for used smartphones.,False,False,False
1641,fly.io,https://fly.io,w2020,Developer Tools,We run app servers close to your users.,False,False,False
1642,NUMI,http://NUMI.supply,w2020,Marketplace,Import marketplace for Africa,False,False,False
1643,Workbench,https://workbenchtech.io,w2020,,Modern manufacturing project management software (MPMS),False,False,False
1644,HiOperator,http://www.hioperator.com,s2016,B2B,"Customer support as a service. We augment your existing team. Plans are pay-as-you-go, scaling up or down as needed based on incoming volume. We are US based, charge on a per *solved* case basis, not per reply, and you only need to train us once.",False,True,False
1645,KubeSail,https://kubesail.com,s2019,Developer Tools,KubeSail is a Deployment platform that you never outgrow. ,False,False,False
1646,Lyrebird,https://lyrebird.ai/,s2017,B2B,Our tech speaks for itself.,False,False,False
1647,DailyBooth,http://dailybooth.com,s2009,Consumer,,True,False,False
1648,Bicycle AI,http://bicycleai.com,w2017,B2B,"Bicycle AI provides customer support as a service. We work on top of existing helpdesks and respond to repetitive and routine support requests.
Weâve built a full stack solution that marries human & machine intelligence.",True,False,False
1649,Vanta,https://vanta.com,w2018,Security,Automated security and compliance,False,True,False
1650,Termii,https://termii.com,w2020,Developer Tools,Termii is Twilio for Africa.,False,False,False
1651,Amplitude,https://amplitude.com,w2012,B2B,Amplitude is the comprehensive product analytics software for web and mobile,False,False,False
1652,Pengram,http://pengramar.com,w2019,Augmented Reality,Indoor navigation through augmented reality on your phone. ,False,False,False
1653,Labdoor,http://labdoor.com,w2015,Marketplace,Labdoor is building the trusted online drugstore.,False,False,False
1654,Macromoltek,https://www.macromoltek.com,w2018,,Computational antibody design,False,True,True
1655,Guggy,https://guggy.com,s2017,Consumer,"Guggy is building the messaging app of the future with real time, NLP-based personalized GIFs",True,False,False
1656,Radix Labs,http://radix.bio,s2018,Other,Operating systems for biology labs,False,False,False
1657,Fastpad,https://fastpad.com/,s2017,B2B,Hiring Software for India,False,False,False
1658,Darmiyan,https://www.darmiyan.com/,s2017,Biomedical,Early detection of Alzheimer's disease,False,True,False
1659,Ready For Zero,http://readyforzero.com,s2010,Fintech,Help people get out of debt. Simplified personal debt and credit management. Acquired by Avant in 2015.,True,False,False
1660,Passerine Aircraft,http://www.passerineaircraft.com/,w2018,Hardware,"Passerine Aircraft is building the next generation of drones
We are developing autonomous fixed wing aircraft capable of taking-off and landing like birds.  ",True,False,False
1661,Aalo,http://www.aalo.co,s2018,Hardware,"Lego-like furniture for design geeks. We create furniture that's hackable, reusable, and customizable to fit your space perfectly no matter how many times you move. ",True,False,False
1662,Remix,https://www.remix.com/,w2015,Enterprise,Weâre building a platform to empower cities to plan the best possible transportation system.,False,True,False
1663,Apportable,http://apportable.com,w2011,Developer Tools,iOS porting,False,False,False
1664,Look After My Bills,http://www.lookaftermybills.com,w2018,Consumer,"Personal fintech - we optimise your bills, every year, automatically.",False,False,False
1665,Osh's Affordable Pharmaceuticals,http://www.oshpharma.com,s2018,Healthcare,Making low cost versions of high cost generic drugs.,False,False,False
1666,Vimcal,http://www.vimcal.com,s2018,Augmented Reality,Superhuman for Calendar,False,False,False
1667,Front,https://frontapp.com,s2014,B2B,Collaborative Inbox for Companies,False,True,False
1668,JITX,http://www.jitx.com,s2018,B2B,Automatic circuit board design.,False,False,False
1669,BHRD,http://bhrdglobal.com,s2018,,"BHRD (""Be Heard"") helps public companies communicate with investors.",True,False,False
1670,Union Apartment,http://www.unionapt.live,w2019,,"Furnished Co-living Apartments for International Students, here in the US.",False,False,False
1671,Heap,https://heap.io/,w2013,Developer Tools,"Heap automatically captures every user interaction in your mobile or web app, letting you generate analytics without writing code or waiting for data.",False,False,False
1672,VanGo,https://www.ridevango.com,w2019,Enterprise,Uber for Kids,False,True,False
1673,Asseta,http://www.asseta.com,s2013,Marketplace,Marketplace for industrial spare parts and capital equipment.,False,False,False
1674,Oxygen,http://getoxygen.com,s2018,,"Oxygen is banking and lending for the gig-economy. We use AI to analyze personal cash flow and credit report data to underwrite freelancers. Free FDIC-insured bank accounts, debit cards, and loans at Avg 27% interest.",False,False,False
1675,iLabService,http://www.ilabservice.com/en,s2018,B2B,Monitoring & Analytics for Lab Services,False,True,False
1676,Per Vices,http://pervices.com,w2012,Developer Tools,"Per Vices Corporation builds software-defined radio (SDR) products. Our Crimson platform provides the flexibility and bandwidth required to support various radio applications used within the infrastructure, defence, and telecommunications industries.",False,False,False
1677,Human Dx,http://humandx.org,s2012,Consumer,The Human Diagnosis Project.,False,False,False
1678,Disqus,http://disqus.com,s2007,B2B,Add comments to your website.,False,False,False
1679,MyVR,http://myvr.com,w2012,B2B,The open platform for the vacation rental industry.,False,False,False
1680,FameGame,https://itunes.apple.com/us/app/famegame-become-a-star/id1343049421?mt=8,s2018,Consumer,Live and interactive TV shows for mobile - starting with American Idol meets HQ Trivia,True,True,False
1681,Toybox,https://www.toyboxsystems.com/,s2018,B2B,Gather feedback and report bugs on your website.,False,False,False
1682,LemonBox,http://www.getlemonbox.com/,s2018,Consumer,Customized daily vitamin packs for Chinese consumers.,False,False,False
1683,Four Growers,https://fourgrowers.co/,s2018,Robotics,Robotic HarvestingRevolutionizing the way we farm; enabling food to be grown anywhere,False,False,False
1684,Kinside,https://www.kinside.com,s2018,Diversity,Child care employee benefits,False,True,False
1685,AirPay,https://www.tryairpay.com/,s2018,,A unified API to help you scale payment and payouts needs,False,True,False
1686,BuyCoins,https://buycoins.africa,s2018,,Cryptocurrency exchange for Africa,False,True,False
1687,Stem Sugar,https://www.stemsugar.com/,s2018,Biotech,Cambridge Glycoscience makes sugar substitutes that actually work in food. ,False,False,False
1688,miru,https://www.miruhome.com,s2018,Developer Tools,Experience any piece of furniture in AR,True,False,False
1689,Gerostate Alpha,http://www.gerostatealpha.com,w2019,Biotech,Developing novel therapeutics for aging and chronic disease,False,False,False
1690,Snark AI,https://snark.ai/,s2018,Artificial Intelligence,Cloud for AI.,False,False,False
1691,Delee,http://www.delee.co    ,w2017,Biomedical,A medical device company who created a companion diagnostic test for cancer therapy management. ,False,True,False
1692,MatterPort,http://matterport.com,w2012,B2B,Turn physical objects and environments into 3D models in seconds.,False,False,False
1693,Presto,http://presto.com,s2010,B2B,"Tablets on restaurant tables, so guests can order, pay and play games from their seat without waiting",False,False,False
1694,Mudrex,https://mudrex.com,w2019,,High yield investments for everyone,False,False,False
1695,AesculaTech,https://www.aesculatech.io/,w2018,Healthcare,"Our vision: a product ecosystem that responds to its environment, driven by materials with a mind of their own.",False,True,False
1696,XGenomes,http://www.xgenomes.com,w2019,Science,"XGenomes is building the sequencing technology of the future. The technology will be low-cost and simple to implement and, will deliver sequences of unprecedented accuracy and completeness. ",False,False,False
1697,Verbling,http://verbling.com,s2011,Marketplace,Language learning through video chat.,False,False,False
1698,Arylla,http://www.arylla.com,w2017,B2B,"We connect products to the internet using an invisible, chip-less tag",False,False,False
1699,AmpUp,https://ampup.io,w2019,Energy,Reservable electric vehicle charging,False,True,False
1700,Prism Labs,https://prism.io,s2017,Marketplace,,False,False,False
1701,BUMP,https://sobump.com,w2018,Marketplace,The ultimate marketplace for authentic fashion,False,False,False
1702,Nectome,https://nectome.com/,w2018,Biotech,Building a way to preserve long-term memories.,False,False,False
1703,Highrise,http://www.joinhighrise.com,s2018,Consumer,Highrise is a creative virtual world where people can express themselves in unique and authentic ways while making meaningful friendships.,False,False,False
1704,Cuanto,https://www.cuanto.app,w2019,,We allow Latin American small businesses create their social media-optimized stores in minutes,False,False,False
1705,Momentus,http://www.momentus.space,s2018,Transportation,Shuttle service for small satellites,False,False,False
1706,Volt Health,https://www.volthealth.com/,w2017,Biomedical,"Volt Health is developing medical devices that deliver electrical stimulation to the muscles of the body to treat disease, starting with urinary incontinence.",False,False,False
1707,Inito,https://www.inito.com/,w2019,Healthcare,Fertility Clinic on your phone.,False,False,False
1708,OpenWrench,https://www.useopenwrench.com,s2018,B2B,We help retailers and restaurant chains manage repairs and maintenance across all their locations.,False,False,False
1709,YSplit,https://www.ysplit.com/,w2019,Consumer,We splits expenses automatically for housemates so that they only pay their share. ,False,False,False
1710,Searchlight,https://www.searchlight.ai/,w2019,Healthcare,Intelligent referencing software to hire the best teams,False,True,True
1711,Sage Care,https://www.getsagecare.com,s2016,Consumer,Get care at home for mom or dad from trusted professionals in their neighborhood. Manage visits through text and email. ,True,True,False
1712,YourChoice Therapeutics,http://ychoicetx.com,w2019,Biotech,YourChoice therapeutics is revolutionizing the contraceptive market by developing a first-in-class non-hormonal unisex contraceptive.,False,True,False
1713,Monthli,http://www.monthli.com,w2016,B2B,Monthli is the first marketplace for homeowner associations.  We offer free property management software to gain access to 360K HOAs and their 30M homeowners.  We charge for premium services and connect vendors to these hard to reach customers.,False,False,False
1714,Reliance Health,https://reliancehealthinc.co/,w2017,Consumer,"Reliance Health uses technology, insurance and clinical care to make healthcare in Africa cheaper and easier to access",False,False,False
1715,Rose Rocket,http://roserocket.com,s2016,B2B,Rose Rocket is ERP software for trucking companies.,False,False,False
1716,Key Values,https://www.keyvalues.com,w2018,Marketplace,Helping software developers find teams that share their values. ,False,True,True
1717,Mobot,http://teammobot.com/,w2019,B2B,Mobot is a mobile app QA service using mechanical robots.,False,True,True
1718,PetaSales,http://petasales.com,w2009,B2B,Online advertising startup.,True,False,False
1719,Maitian.ai,https://maitian.ai,w2019,Artificial Intelligence,"We make $1,000 Amazon Go stores.",False,False,False
1720,Tradewind BioScience,https://www.tradewindbio.com,w2018,,Tradewind BioScience is building therapeutics to attack the most deadly human cancers. Our current lead is a humanized antibody that inhibits ovarian cancer growth and metastasis.,False,False,False
1721,FloydHub,http://www.floydhub.com/,w2017,Developer Tools,Floyd is Heroku for Machine Learning and Deep Learning. Run and deploy your project to the cloud with zero-setup. ,False,False,False
1722,Balto,http://playbalto.com,w2019,Consumer,Contest automation software targeting the $150B sports betting market,True,False,False
1723,Correlia Biosystems,http://www.correliabio.com,w2018,Biotech,Next generation blood testing to provide 1000x more data to pharma companies,False,False,False
1724,Apprentice Health,https://www.apprenticehealth.com,s2018,Healthcare,We deploy sensors and software that increase hospital efficiency.,False,False,False
1725,Dharma Labs,https://dharma.io,s2017,Fintech,"Dharma is the easiest place to borrow and lend cryptocurrencies â anywhere in the world, instantly and securely. ",False,False,False
1726,Buypower,http://www.buypower.ng,w2017,Consumer,Buypower is the Paypal of Africa starting from Nigeria by making the purchase of electricity extremely easy for Africans. We light up homes at the click of a button.,False,False,False
1727,70 Million Jobs,https://www.70MillionJobs.com,s2017,Marketplace,"The first national, for-profit employment platform for people with criminal records. ",False,False,False
1728,NetBeez,https://netbeez.net,w2016,Enterprise,High Performance Network Monitoring for the Distributed Enterprise.,False,False,False
1729,Shiru,https://www.shiru.com/,s2019,Biotech,Shiru leverages ML to create proteins to feed the world sustainably. ,False,True,True
1730,Tingles,https://www.gettingles.com,w2018,Consumer,Find content that helps you relax and fall asleep.,False,False,False
1731,Supr Daily,http://www.suprdaily.com/,w2017,Consumer,Daily milk delivery service in India,False,False,False
1732,EnvKey,https://www.envkey.com,w2018,Security,1Password for API keys,False,False,False
1733,Necto,http://joinnecto.com,w2018,B2B,ISP starter kit,True,False,False
1734,Whyd,https://whyd.com,s2016,,"We make a beautiful, great sounding, voice-controlled speaker. ",True,False,False
1735,Woody Library,http://www.woodylibrary.com/,w2019,Education,Woody Library is Netflix for physical books in China. ,False,False,False
1736,Marft,http://marft.com,w2012,Developer Tools,"Marft creates embeddable machine learning models for application developers. Users submit data by web/API, and receive optimized models implemented in a language of their choice.",False,False,False
1737,Jumpchat,http://jumpchat.com,s2006,Consumer,,True,True,False
1738,NuCypher,https://www.nucypher.com/,s2016,Developer Tools,Cryptographic Infrastructure for Privacy-Preserving Applications,False,False,False
1739,Memamp,http://memamp.com,s2005,Consumer,,True,False,False
1740,COUTURME,https://couturme.com,w2019,Artificial Intelligence,"We custom design and produce women's formal dresses, starting with the wedding gowns. We can do that without designers and pattern makers, by using our own CAD software.",False,True,False
1741,Nextop,http://nextop.io,w2015,Developer Tools,"Nextop optimizes the path between your app and backend. Client libraries + proxy server. Improves speed, reliability, and battery usage with no change to your backend.",True,False,False
1742,HigherMe,http://higherme.com,w2015,B2B,"HigherMe helps retail and restaurant employers find, screen, and hire better employees faster.",False,False,False
1743,Skill-lync,http://skill-lync.com,w2019,Education,Online engineering college for India. Learn technical skills & get recruited,False,False,False
1744,Fit to Form,http://thefittoform.com,s2019,Healthcare,Fit to Form is a site where women shop for dresses based on their exact measurements.,False,True,True
1745,Tremendous,https://www.tremendous.com,w2011,B2B,"Helping businesses reward and incentivize anyone in the world, easily and instantly, with gift cards, Visa prepaid cards and money.",False,False,False
1746,CyberFend,http://cyberfend.com,w2015,B2B,"Cyberfend delivers robust, real-time web and mobile security by preventing account take-over, synthetic sign-ups and monetary fraud. In addition, Cyberfend's BotFender is the most comprehensive bot/automation detection service available today. ",False,False,False
1747,Latchel,http://latchel.com,w2019,B2B,24/7 emergency maintenance department for property managers and landlords. ,False,False,False
1748,Memfault,https://memfault.com,w2019,Developer Tools,Memfault builds developer tools for firmware engineers.,False,False,False
1749,Station,https://getstation.com/,w2018,B2B,Station is building the browser for work. It is a native desktop application unifying within a single interface all of the web applications used by an employee at work. ,False,False,False
1750,Allure Systems,http://www.alluresystems.com/,w2019,Virtual Reality,AllureSystems uses A.I. to create stunning apparel images for eCommerce. Allure works with leading fashion retailers to improve conversion rates by creating images that resonate with their clients in a scalable and cost effective way. ,False,True,False
1751,Paladin Cyber,https://www.meetpaladin.com,s2017,B2B,Cyber security insurance for small businesses. Experts in Cyber security/compliance for startup needs as well.,False,False,False
1752,Nowports,https://nowports.com/,w2019,Transportation,Nowports is a digital Freight Forwarder shipping ocean containers to and from Latin America.,False,False,False
1753,Patchd Medical,http://patchdmedical.com,w2018,,Wearable devices which use Deep Neural Networks to predict and prevent sepsis (the #1 cause of hospital death).,False,False,False
1754,Pursuit,http://www.revlo.co,s2016,B2B,Revlo helps broadcasters on Twitch engage and monetize their fan base. We do this by allowing broadcasters to create interaction opportunities for their fans at scale.,False,True,False
1755,Pigeonly,http://pigeonly.com,w2015,Consumer,"The affordable way to search, find & communicate with an incarcerated loved one",False,False,False
1756,Slik,http://slik.ai,s2017,B2B,Slik enables the long tail to use email outreach. ,False,False,False
1757,Double Robotics,https://doublerobotics.com,s2012,Hardware,Telepresence robots,False,False,False
1758,Hickory,http://hickorytraining.com,s2015,Enterprise,Hickory turns your employees into experts.,True,False,False
1759,Riley,https://getrileynow.com,w2017,B2B,MailChimp for SMS ,True,False,False
1760,Pulse Active Stations Network,http://www.getpulse.in/,w2019,Healthcare,We are a connected network of smart health kiosks in India.,False,False,False
1761,Pronto,http://www.tupronto.mx/,w2019,Transportation,Ride-sharing for second-tier cities in Latin America.,False,True,False
1762,Lendsnap,http://lendsnap.com,s2016,Fintech,"The Digital Mortgage Company. Lendsnap automatically gathers loan qualifying documents and data to take the pain out of lending. Lendsnap is the only account aggregator enhancing portfolio liquidity with original source documents.
",True,False,False
1763,Mindori,http://www.mindori.com,s2016,Enterprise,Mindori builds white-label voice search for e-commerce apps.,True,False,False
1764,BlueLots,http://source.com,w2017,B2B,"Source.com is a B2B marketplace for purchasing and selling excess inventory, wholesale, and liquidation goods.",False,False,False
1765,Tandem,https://tandem.chat,s2019,Developer Tools,Tandem is a virtual office for remote and distributed teams.,False,False,False
1766,Dover,http://dover.io,s2019,Marketplace,Helping top companies source the best talent.,False,True,False
1767,Meetingbird,https://www.meetingbird.com,s2017,B2B,Automated meeting scheduling for teams,False,False,False
1768,OneChronos,https://www.onechronos.com/,s2016,Fintech,"A financial exchange that reduces costs, increases trading volume, and prevents information leakage via a revolutionary approach to matching buyers with sellers.",False,False,False
1769,Trella,https://www.trella.app/,s2019,B2B,"Trella is a platform that connects shippers to carriers. Trella offers services and technology to empower drivers, improve their efficiency, boost their earnings and utilization as well as creating job opportunities.",False,False,False
