,name,url,batch,vertical,description,dead,has_ff,all_ff
518,Dataform,https://dataform.co,s2018,Other,"Manage data in Snowflake, BigQuery and Redshift",False,False,False
519,Hyperink,http://hyperinkpress.com,w2011,B2B,Ebook publisher.,True,False,False
520,Khatabook,https://khatabook.com/,s2018,Consumer,Replace your traditional udhaar bahi khata by new digital KhataBook,False,False,False
521,Seawise Capital,https://www.seawisecapital.com,w2019,,Trade finance company for Indian exporters,False,False,False
522,Leena AI,https://www.leena.ai,s2018,Enterprise,"We at Leena AI build a virtual assistant that answers employee's HR questions eg. How do I sign up for dental insurance, What's my 401k contribution? Why is my salary less this month? As a result, an HR professional can save 4 hours a day.",False,False,False
523,Mylk Guys,http://www.mylkguys.com/,s2018,Consumer,Amazon for Vegans,True,False,False
524,Everyday.me,http://everyday.me,s2012,Consumer,Everyday.me - Record your life.  Store it forever.  ,True,False,False
525,Comprehend,http://comprehend.com,w2011,B2B,SaaS to increase speed and quality of clinical trials.,False,False,False
526,MicroEval,http://microeval.com,s2012,B2B,"Changing the way companies review employee performance with quantitative, short, easy-to-do evaluations.",True,True,False
527,Snipshot,http://snipshot.com,w2006,Consumer,We sold Snipshot to Ansa in 2013.,True,False,False
528,Symple,http://www.getsymple.com/foodservice,w2017,B2B,"Last mile logistics for delivery & service teams. We bring real-time collaboration to distributed job workflows, across scheduling, routing, live tracking, work orders, invoices and payments.",True,False,False
529,Ginza,https://www.demandsphere.com/,s2010,B2B,"SEO & Content Marketing Analytics. Enterprise-focused SaaS with customers in the US, Japan, and other parts of Asia.",False,False,False
530,Pomello,http://pomello.com,w2015,B2B,"Analytics software that helps companies measure organizational culture, screen talent for ""fit"", and drive high performance cultures.",False,True,False
531,Alpha Vantage,https://www.alphavantage.co/,s2018,Developer Tools,We build accessible and easy to use APIs for financial market data.,False,False,False
532,Restocks,https://restocks.io,w2016,Consumer,Buy sneakers and streetwear here,True,False,False
533,NewsBlur,https://www.newsblur.com,s2012,Consumer,NewsBlur is an RSS news reader with intelligence.,False,False,False
534,Virool,http://virool.com,s2012,B2B,Virool provides native video advertising experience for the biggest publishers on the web. ,False,False,False
535,Shoutfit,http://shoutfit.com,s2006,Consumer,,True,False,False
536,Padlet,https://padlet.com,w2013,,Papyrus â Parchment â Paper â Padlet,False,False,False
537,Amicus,http://amicushq.com,s2012,B2B,"Helps nonprofits & campaigns win more donors, more members, more votes",True,False,False
538,Profig,http://profig.com,s2012,B2B,"The phone system for businesses. Manage everything from your company phone system to outbound sales call centers to inbound customer support call centers, all from a single dashboard. ",True,False,False
539,HistoWiz,http://histowiz.com,w2016,Hardware,Accelerating Histopathology for Cancer Research ,False,True,True
540,Ninite,http://ninite.com,w2008,Consumer,Simple third-party app patching and deployment for Windows.,False,False,False
541,Compgun,http://compgun.com,w2016,B2B,Sales commission software that grows revenue.,True,False,False
542,Partnered,http://partnered.com,s2012,B2B,Partnered is a digital platform automating business development partnerships between brands and startups.,True,False,False
543,Mayhem,https://www.mayhem.gg,w2018,Consumer,Mayhem is the easiest way to play with your gaming community.,False,False,False
544,3dot,http://3dot.com,w2015,Consumer,,True,False,False
545,Auctomatic,http://auctomatic.com,w2007,Marketplace,,False,False,False
546,Xobni,http://xobni.com,s2006,Consumer,,False,False,False
547,Mailgun,http://mailgun.net,w2011,Developer Tools,Email API service.,False,False,False
548,Flightcaster,,s2009,Consumer,,False,False,False
549,Socialcam,http://www.socialcam.com,w2012,Consumer,The easiest way to share videos with friends and family. ,False,False,False
550,Upsolve,https://upsolve.org,w2019,,TurboTax for Bankruptcy (nonprofit),False,False,False
551,StackMachine,http://stackmachine.com,s2013,Developer Tools,Instant sandboxed server environments,True,False,False
552,Picplum,picplum.com,s2011,Consumer,,True,False,False
553,Futureleague,http://www.futureleague.co,w2014,Marketplace,"Engineering and Programming for Kids 6-12 with a focus on creativity, teamwork, and design thinking. In private beta, in-person, soon to be online",True,True,True
554,Testmunk,http://testmunk.com,s2012,Developer Tools,Automating mobile app testing.,True,False,False
555,Lanyrd,http://lanyrd.com,w2011,Consumer,IMDB of conferences.,False,True,False
556,Brace,http://brace.io,w2012,Developer Tools,Backlift allows front-end only developers to build entire websites and deploy them instantly via Dropbox. ,True,False,False
557,Teleborder,http://teleborder.com,s2013,B2B,Dashboard for companies to manage immigration for their employees.,True,False,False
558,Crowdery,http://crowdery.com,s2013,B2B,"[Now Clara, YC S14- claralabs.com]",True,True,False
559,Realm,http://realm.io,s2011,Developer Tools,Better data structures = no DB.,False,False,False
560,Kash,http://withkash.com,s2014,Fintech,We are fixing how money works.,False,False,False
561,zeroheight,https://zeroheight.com,s2019,Developer Tools,We let any company create a beautiful design system site,False,False,False
562,Tipjoy,http://tipjoy.com,w2008,B2B,social micropayments,True,True,False
563,Treehouse,http://gotreehouse.com,s2008,,,True,False,False
564,Flutter,http://flutterapp.com,w2012,Developer Tools,"Flutter combined computer vision technology with the built-in webcams in laptops, iPads, smartphones and TVs to let users control these devices with gestures, facial expressions, hints and body-language.  Flutter became part of Google in Oct 2013.
",False,False,False
565,Mixwit,http://cloud.tv,w2008,Consumer,"Online mixtape service (create and share mixtapes). Launched as part of W08 batch, stopped at the end of 2008 due to negative forecast for ""grey area"" online music services.

Formed new partnership in 2009 as cloud.tv",True,False,False
566,Freshplum,http://freshplum.com,s2011,B2B,Analytics with action,False,False,False
567,Penny,https://www.pennyapp.io,w2017,Consumer,Penny makes keeping track of your finances as easy as having a conversation.,False,False,False
568,Voxli,http://voxli.com,w2009,Consumer,,True,False,False
569,Wavy,http://downloadwavy.com,w2017,,Experience music and art in augmented reality,False,True,False
570,Trigger,http://trigger.io,w2008,Developer Tools,Better PhoneGap.,True,False,False
571,Spaces Life,http://spaceslife.com,w2009,Fintech,,True,False,False
572,TomoGuides,http://tomoguides.com,s2012,Consumer,"Mobile travel guides done right.  Personalized, context-aware, and offline-friendly!",True,False,False
573,Zidisha,http://zidisha.org,w2014,Consumer,Direct P2P lending across the international wealth divide.,False,True,True
574,D-ID,https://www.deidentification.co/,s2017,Enterprise,"Protecting faces from being identified by facial recognition technologies. Helping governments, HLS and corporations to comply with regulations and secure their citizens, agents, employees and customers.",False,False,False
575,Layer By Layer,http://layerbylayer.com,s2013,Marketplace,"Acquired by MakerBot in February 2014. 

A marketplace for 3D printable products - just like the iTunes app store, but for 3D printing. 

We don't sell physical products, and we don't sell design files, but rather we sell single prints. ",False,False,False
576,Outtalent,http://outtalent.com,s2019,Education,We help top engineers in emerging markets get jobs abroad at companies like Google.,False,False,False
577,Sixfold Bioscience,https://www.sixfold.bio,w2018,Biotech,Nanoparticles to deliver cell and gene therapies.,False,True,False
578,Carsabi,http://carsabi.com,w2012,Consumer,Carsabi is the search engine for used cars,True,False,False
579,Zestful,https://zestful.com/,w2017,Enterprise,"The easiest way for companies to give individualized perks to their employees. Give perks like Spotify, Netflix, Blue Apron, Corepower Yoga, StubHub and hundreds more - all without a painful reimbursement process.",False,False,False
580,Biobot Analytics,http://biobot.io,w2018,Healthcare,We analyze city sewage to estimate opioid consumption.,False,True,True
581,Ravti,http://ravti.com,s2014,B2B,"Software to track, manage, and procure HVAC for commercial real estate.  ",False,False,False
582,Hopper,http://hopper.ai,w2018,Artificial Intelligence,,True,False,False
583,Open Listings,https://www.openlistings.com,w2015,Marketplace,A better way to buy a home,False,False,False
584,Dashblock,https://dashblock.com,s2019,Artificial Intelligence,Turn any website into an API,False,False,False
585,The Buttermilk Company,http://www.thebuttermilkco.com,s2018,Consumer,"Instant, fresh ethnic food that actually taste homemade. We're disrupting the ethnic food market by turning crowdsourced recipes into easy-to-make and fresh food for the growing first/second-gen immigrant population., ",True,True,True
586,Sterblue,http://www.sterblue.com,s2018,Drones,Software for drones to inspect power lines and wind turbines,False,False,False
587,Viaopt,http://www.viaopt.com,s2018,B2B,Uber pool for corporate trucking fleets,False,False,False
588,Boosted,http://boostedboards.com,s2012,Hardware,"Simple, fun, and fast electric vehicles.",False,False,False
589,KidPass,https://www.kidpass.com,w2017,Marketplace,KidPass is the leading marketplace for parents to discover and book all types of kids activities and services.,False,False,False
590,Rain Neuromorphics,http://www.rain-neuromorphics.com,s2018,Artificial Intelligence,We build artificial intelligence processors inspired by the brain.  ,False,False,False
591,Mertado,http://mertado.com,w2010,Marketplace,,False,False,False
592,Tech in Asia,http://techinasia.com,w2015,Consumer,Tech in Asia (YC W15) is the largest English-language technology media company that focuses on Asia.,False,False,False
593,Clear Genetics,https://cleargenetics.com/,w2017,Biomedical,Clear Genetics is scaling delivery of Genomic services,False,True,False
594,Medmonk,http://medmonk.com,w2012,B2B,A tool for pharmacists to find funding for patients who are unable to pay for their medications.,False,True,False
595,Weebly,http://weebly.com,w2007,B2B,"Web site editing platform.  Over 40M people have launched their business on Weebly and every month 325M people visit a Weebly-made site, or 50% of the US.",False,False,False
596,Sift,https://sift.com/,s2011,B2B,"We use machine learning to power Trust & Safety for thousands of online businesses; eliminating chargebacks, fake accounts, account takeover, and spam, and reducing user friction to drive growth.",False,False,False
597,RoboHR,http://robohr.com,s2009,,,True,False,False
598,NudgePad,http://nudgepad.com,s2009,Developer Tools,Online IDE. We joined Microsoft in 2014.,True,False,False
599,Fintual,https://fintual.com,s2018,,Wealth manager for Latin America,False,False,False
600,Meru Health,http://www.meruhealth.com,s2018,Healthcare,An online provider for greater mental health,False,False,False
601,Percept.AI,https://www.percept.ai/,s2019,B2B,AI support agent for your business that actually works,False,False,False
602,Booktrope,http://booktrope.com,w2015,Consumer,Booktrope provides a software platform that makes it easy for creative teams to turn manuscripts into polished books and market them â at scale.,True,True,False
603,Hackermeter,http://hackermeter.com,s2013,Consumer,Replacing resume screening with code challenges.,False,True,False
604,Omnisio,http://omnisio.com,w2008,Consumer,Edit and enhance online video. Acquired by Google in July 2008.,False,False,False
605,Bitplay,http://meetings.io,w2010,B2B,"Effortless Video Meetings
- Acquired by Jive Software in 2013",False,False,False
606,Wit.ai,http://wit.ai,w2014,Developer Tools,"Natural Language for Developers --
Wit is an API that makes it easy for developers to create apps that you can talk and text to. It turns speech or text into actionable data.",False,False,False
607,Unima,http://www.unima.com.mx,w2016,Hardware,Fast and low-cost diagnostics for real time disease surveillance,False,True,False
608,Blueberry Medical,https://blueberrypediatrics.com,w2019,Healthcare,24/7 access to pediatricians and at-home medical testing kit,False,False,False
609,Vastrm,http://vastrm.com,s2012,Consumer,Mass customized active apparel. We are building a full turn key technology and manufacturing platform that will allow other retailers and brands to be able to offer customized apparel to their customers.   Get your corporate apparel with us :),False,False,False
610,Balanced,http://balancedpayments.com,w2011,Fintech,Payments for Marketplaces,True,False,False
611,Habit Labs,http://habitlabs.com,s2010,Consumer,Friends motivate one another: I'll do x if you do y.,True,True,False
612,Zenter,http://zenter.com,w2007,Consumer,,False,False,False
613,Carry,https://carry.travel,s2019,,"Carry plans, books, and supports corporate travel for all your employees over Slack, email, and SMS. We provide an executive assistant for travel so that employees never have to be stuck on the phone with an airline again.",False,False,False
614,Medigram,http://medigram.com,w2012,B2B,"We are making a HIPAA-compliant, Groupme app for doctors to communicate in the hospital, as an alternative to pagers.  ",False,False,False
615,Bouncer,https://www.getbouncer.com/,s2019,Security,SDK for scanning and verifying credit cards and photo IDs in mobile apps  ,False,False,False
616,Raptor Maps,http://www.raptormaps.com,s2016,Hardware,Raptor Maps makes software to manage solar farm construction and maintenance.,False,False,False
617,Shelf Engine,http://www.shelfengine.com,s2018,Marketplace,Shelf Engine replaces the grocery buyer and guarantees sales for the grocery store.,False,False,False
618,Neptune.io,http://neptune.io,s2014,Developer Tools,A self-healing platform to enrich and fix server alerts automatically,True,False,False
619,True Link,https://www.truelinkfinancial.com/,s2013,Consumer,"Financial services for older adults, people with disabilities, and people in recovery.",False,True,False
620,FlightCar,http://flightcar.com,w2013,Marketplace,"FlightCar is the Airbnb of Car Rentals at Airports.
We allow people to rent their car out to other travelers while they are gone, so they get free airport parking and make money. Renters get a cheaper rental. We also provide $1m of insurance.",True,False,False
621,Gobble,http://gobble.com,w2014,Consumer,"Daily meal delivery, personalized to your tastes.",False,True,True
622,Poppy,http://meetpoppy.com,w2016,Consumer,Poppy makes it easy for parents to find high quality childcare with just a text.,True,True,False
623,Castle,http://entercastle.com,w2016,B2B,Castle manages rental homes for landlords using automation and on-demand labor.,True,False,False
624,Seneca Systems,https://www.senecagov.com,s2016,Enterprise,Constituent system-of-record and service request management software for local government.,False,False,False
625,Parse,http://parse.com,s2011,Developer Tools,Parse is the easiest way to build apps.,False,False,False
626,Women Who Code,https://www.womenwhocode.com/,s2016,Developer Tools,WWCode is a non profit with a set of programs that helps mid-career engineers get promoted.,False,True,True
627,Prowess,https://app.prowess.app,s2019,Developer Tools,We translate your web app with human translators in under 30 minutes.,False,False,False
628,Drivezy,http://www.drivezy.com,s2016,Marketplace,"India's largest vehicle sharing platform, turning people's vehicles into earning members of the family.",False,False,False
629,Reebeez,http://www.reebeez.co/,s2016,Hardware,"Reebeez creates powerful microengines for UAVs. With a 2hr + flight time, our microengine has a specific energy 8x better than batteries at a third of the cost. Reebeez expands the possibilities and applications of UAVs!",False,True,True
630,RocketLit,http://www.rocketlit.com,s2016,Education,"RocketLit is an adaptive learning and assessment platform. We write articles at 7 different reading levels, serve them to every student in a classroom at their independent reading level, and fluidly adapt the level students receive as they improve. ",False,False,False
631,DirectShifts,https://directshifts.com,s2019,Healthcare,Marketplace for doctors to find short term shift work at hospitals ,False,False,False
632,Kudi,https://kudi.com,w2017,B2B,Making financial services accessible and affordable for all Africans.,False,False,False
633,Stitch Health,https://stitch.health/,w2016,B2B,Care Coordination Platform for Healthcare,True,False,False
634,Peer5,https://www.peer5.com,w2017,B2B,P2P delivery network that enables high quality video streaming at massive scale.,False,False,False
635,Hivy,https://hivyapp.com,w2017,B2B,"An end-to-end platform for office management. We enable office management teams to gather employees' requests, collaborate on projects and manage their vendors. ",False,True,False
636,Magic Instruments,http://www.magicinstruments.com,w2016,,"Magic Instruments makes a high-tech guitar that is easier and more enjoyable to learn, that anyone can play instantly.",True,False,False
637,RevenueCat,https://www.revenuecat.com/,s2018,Developer Tools,RevenueCat is a simple API for managing in-app subscriptions. ,False,False,False
638,Traversal Networks,http://traversalnetworks.com,s2015,B2B,"Enterprise Threat Detection: Tuning, Triage, and Analysis by Experts.",True,False,False
639,Flock Safety,http://www.flocksafety.com,s2017,Hardware,Flock solves crime by building technology to capture evidence,False,False,False
640,Py,https://www.getpy.com,s2017,Education,Py is democratizing access to career opportunities in tech,False,False,False
641,Perfect Audience,http://perfectaudience.com,s2011,B2B,Self-service display advertising for SaaS and online retail.,False,False,False
642,Nightingale,http://nightingaleapp.com,s2014,B2B,App for managing care of autistic students,True,False,False
643,Talkable,http://talkable.com,w2011,B2B,Online store referrals.,False,False,False
644,Dreamforge,http://dreamforge.me,s2012,B2B,Simple 3d modeling software for 3d printers.,True,False,False
645,SalesSift,https://salessift.com,s2014,B2B,Intelligent Lead Sourcing,True,False,False
646,NEXGENT,https://www.nexgent.com/,w2018,Education,,False,False,False
647,GBatteries,https://www.gbatteries.com,w2014,,Enabling li-ion batteries to charge ultra fast without compromising cycle life.,False,False,False
648,Portal Entryways,https://www.portalentryways.com/,w2019,B2B,"Portal Entryways upgrades disabled-accessible doors so they can be opened, completely hands-free, by any smartphone.",False,False,False
649,Hipset,http://tracksby.com,s2012,B2B,The best way for artists to release new music and videos.,True,False,False
650,Social Construct,http://socialconstructco.com,s2017,Hardware,Social Construct designs and assembles large apartment buildings  from modules (like LEGOs).,False,False,False
651,RegistryLove,http://registrylove.com,s2012,Marketplace,Cross-store wedding registry.,True,True,False
652,Ginkgo Bioworks,http://ginkgobioworks.com,s2014,Biomedical,Our mission is to make biology easier to engineer.,False,True,False
653,PayDragon,http://paperlinks.com,s2011,Marketplace,Hyperlinking the real world.,True,False,False
654,Sparkboard,http://sparkboard.com,s2012,B2B,,False,False,False
655,Team Apart,http://teamapart.com,s2008,Consumer,,True,False,False
656,Zoomer,http://www.zoomerdelivery.com,s2014,B2B,"Outsourced, high volume food delivery.

",True,False,False
657,Next Caller,http://nextcaller.com,w2014,B2B,Next Caller creates a positive customer experience through real-time call verification technology. We verify the authenticity of phone numbers to increase efficiency in enterprise call centers.,False,False,False
658,Hush,http://www.shophush.com,s2016,Consumer,Hush is the top social commerce app in the United States. ,False,False,False
659,Lambda School,https://lambdaschool.com,s2017,Education,We train people to be software engineers for free in exchange for a share of their future income,False,False,False
660,Tambua Health,https://www.tambuahealth.com,w2020,Healthcare,"We are developing a device â "" called T-Sense"", that uses sound to take a picture of the lungs, like an x-ray but with sound instead of radiation",False,False,False
661,Svbtle,https://svbtle.com,s2012,Consumer,A publishing platform.,False,False,False
662,Cymmetria,http://cymmetria.com,s2015,Enterprise,Shifting the asymmetry of cyber security.,False,False,False
663,Keychain Logistics,http://keychainlogistics.com,s2012,Marketplace,Software that connects the supply side of companies that ship product with independent carriers that move product. ,True,False,False
664,Zanbazaar,http://zanbazaar.com,s2006,,Community-curated catalogs for product recommendations,True,False,False
665,Klarismo,http://klarismo.com,s2015,Biomedical,Klarismo turns your body into an interactive experience. We built a fully automated  pipeline for quantitative medical image analysis that unlocks the non-diagnostic value in MRI scans and empowers patients to take a fantastic journey into their body,True,False,False
666,Omgpop,http://omgpop.com,s2006,Consumer,,False,False,False
667,HireArt,http://hireart.com,w2012,B2B,We simulate the work environment to find out who's best for the job. ,False,True,False
668,Strikingly,https://www.strikingly.com,w2013,B2B,"The easiest way to create a beautiful, mobile optimized website.",False,False,False
669,Curtsy,http://curtsyapp.com/,s2019,Marketplace,Curtsy is an app that lets women buy and sell clothes from their phones,False,False,False
670,Talkray (TiKL),http://talkray.com,w2012,Consumer,"Instantly talk or text to one or a group of friends at once with the touch of a button. No setup needed. Fast, simple and free - TiKL turns your phone into the ultimate Push To Talk (PTT) Walkie Talkie with instant messenger capability.",False,False,False
671,Fond,http://fond.co,w2012,B2B,Rewards and recognition SaaS for HR leaders,False,False,False
672,OneLocal,https://onelocal.com/,s2017,B2B,OneLocal is a CRM for local businesses.,False,False,False
673,PlanGrid,http://plangrid.com,w2012,B2B,We build mobile applications for the construction industry,False,True,False
674,Rescue Forensics,http://rescueforensics.com,w2015,Enterprise,Actionable human trafficking intelligence,True,False,False
675,Naytev,http://naytev.com,s2014,B2B,"Naytev optimizes the packaging and distribution of social content, saving teams time and driving more social conversions.",False,False,False
676,Skip,https://rideskip.com/,w2018,,Electric scooters for reliable last-mile transportation.,False,False,False
677,Newcope,http://newcope.com,w2010,,,True,False,False
678,Skypher,https://skypher.co,w2020,Security,Cybersecurity compliance in a box,False,False,False
679,Snapboard,https://snapboard.io,w2020,,,False,False,False
680,Breathe Well-being,http://www.breathewellbeing.in,w2020,Healthcare,"A digital well-being program to help people prevent or manage chronic lifestyle diseases (like Prediabetes and Type 2 Diabetes) in a cheaper, convenient and more effective way (think Noom for India).",False,False,False
681,Imgfave,http://imgfave.com,s2012,Consumer,A fun image sharing community.,True,False,False
682,Luminostics,http://www.luminostics.com,s2016,Consumer,"Rapid, accurate, and inexpensive at-home diagnostics for infectious diseases ",False,False,False
683,VINEBOX,http://www.getvinebox.com,w2016,Consumer,"Wine by the glass, at home",False,True,False
684,Avametric,http://www.Avametric.com,w2014,B2B,Simulate clothes on your body.,False,False,False
685,H1,https://h1insights.com/,w2020,Healthcare,H1 is a global database of every healthcare professional and healthcare organization.,False,False,False
686,Hipmunk,http://hipmunk.com,s2010,Consumer,"Hipmunk takes the agony out of searching for flights, accommodations, cars, and more.",False,False,False
687,Le Tote,http://letote.com,s2013,Consumer,Subscription service for women's apparel & accessories. ,False,True,False
688,Tutorspree,http://tutorspree.com,w2011,Marketplace,Tutor marketplace.,True,False,False
689,Priceonomics,http://priceonomics.com,w2012,Consumer,We help companies turn their data into great stories.,False,False,False
690,imgix,https://www.imgix.com,s2011,B2B,"Responsive images as a service, delivered by CDN.",False,False,False
691,Synthetic Minds,http://synthetic-minds.com,s2018,,Program synthesis for provably correct code,False,False,False
692,Arthena,https://www.arthena.com,w2017,Consumer,Quantitative Investment in Art Assets ,False,True,False
693,Tsumobi,http://tsumobi.com,w2007,Consumer,Messaging.,True,False,False
694,Reebee,http://reebee.com,s2013,Consumer,Flyer app.,False,False,False
695,Coinbase,https://www.coinbase.com,s2012,Fintech,Coinbase is a secure platform that makes it easy to buy and sell cryptocurrency,False,False,False
696,Weilos,http://weilos.com,s2013,Consumer,Weight loss coaching.,False,False,False
697,Jamiphy,https://jamiphy.com,w2020,Entertainment,TikTok for Musicians,False,False,False
698,Reble,http://reble.fm,s2007,Consumer,P2P Music Sharing,True,False,False
699,Meta,http://www.metavision.com/,s2013,Hardware,Augmented reality glasses.,True,False,False
700,Shopular,http://shopular.com,w2012,Consumer,"Deals, Coupons & Cash Back for your favorite stores.",False,False,False
701,Ambient,https://ambient.ai,w2017,B2B,Visual intelligence for the real world.,False,False,False
702,Grouper,http://joingrouper.com,w2012,Consumer,We set up drinks between 2 groups of friends: 3 guys and 3 girls.,True,False,False
